afsc,label,text_norm,source_doc,evidence,page,chunk_idx,extractor_version
1A3X1,A,Following complex procedures and checklists precisely,llm,Following complex procedures and checklists precisely,,1,llm_v0
1A3X1,A,Situational awareness during ground and flight operations,llm,Situational awareness during ground and flight operations,,1,llm_v0
1A3X1,A,Leadership to direct loading teams and enforce compliance,llm,Leadership to direct loading teams and enforce compliance,,1,llm_v0
1A3X1,A,Problem solving and troubleshooting during inspections and operations,llm,Problem solving and troubleshooting during inspections and operations,,1,llm_v0
1A3X1,A,Time management to meet mission schedules,llm,Time management to meet mission schedules,,1,llm_v0
1A3X1,K,Principles of aircraft propulsion and engine operation,llm,Principles of aircraft propulsion and engine operation,,2,llm_v0
1A3X1,K,"Aircraft systems theory: electrical, communications, navigation, hydraulic, pneumatic, fuel, environmental control (air conditioning, pressurization, ventilation), auxiliary power unit, lubrication",llm,"Aircraft systems theory: electrical, communications, navigation, hydraulic, pneumatic, fuel, environmental control (air conditioning, pressurization, ventilation), auxiliary power ",,2,llm_v0
1A3X1,K,Engine instrumentation and performance parameters,llm,Engine instrumentation and performance parameters,,2,llm_v0
1A3X1,K,"Procedures for engine start, run-up, flight operations, and shutdown",llm,"Procedures for engine start, run-up, flight operations, and shutdown",,2,llm_v0
1A3X1,K,"Warning and annunciation systems (fire, overheat, depressurization, system failure) and associated procedures",llm,"Warning and annunciation systems (fire, overheat, depressurization, system failure) and associated procedures",,2,llm_v0
1A3X1,K,"Air refueling concepts: system components, envelopes, contact/disconnect procedures",llm,"Air refueling concepts: system components, envelopes, contact/disconnect procedures",,2,llm_v0
1A3X1,K,Emergency fuel transfer procedures (on-load/off-load) and general aircraft emergency procedures,llm,Emergency fuel transfer procedures (on-load/off-load) and general aircraft emergency procedures,,2,llm_v0
1A3X1,K,Radio/aircrew communication procedures and phraseology,llm,Radio/aircrew communication procedures and phraseology,,2,llm_v0
1A3X1,K,Passenger cabin safety and service standards,llm,Passenger cabin safety and service standards,,2,llm_v0
1A3X1,K,"Aircraft forms, documentation, and border/customs clearance requirements",llm,"Aircraft forms, documentation, and border/customs clearance requirements",,2,llm_v0
1A3X1,K,"Aircraft scanning and clearance concepts, threat identification, and collision avoidance",llm,"Aircraft scanning and clearance concepts, threat identification, and collision avoidance",,2,llm_v0
1A3X1,K,Crew resource management (CRM) principles,llm,Crew resource management (CRM) principles,,2,llm_v0
1A3X1,S,Starting and shutting down aircraft engines,llm,Starting and shutting down aircraft engines,,2,llm_v0
1A3X1,S,Operating engine controls to optimize efficiency and economy,llm,Operating engine controls to optimize efficiency and economy,,2,llm_v0
1A3X1,S,Monitoring and interpreting engine and system instruments,llm,Monitoring and interpreting engine and system instruments,,2,llm_v0
1A3X1,S,"Operating and regulating aircraft systems (electrical, communications, navigation, hydraulic, pneumatic, fuel, environmental, APU, lubrication)",llm,"Operating and regulating aircraft systems (electrical, communications, navigation, hydraulic, pneumatic, fuel, environmental, APU, lubrication)",,2,llm_v0
1A3X1,S,Detecting and interpreting warning indicators and annunciators,llm,Detecting and interpreting warning indicators and annunciators,,2,llm_v0
1A3X1,S,Reporting abnormalities and recommending corrective actions to the pilot,llm,Reporting abnormalities and recommending corrective actions to the pilot,,2,llm_v0
1A3X1,S,"Providing passenger comfort and preparing/serving meals, snacks, and refreshments",llm,"Providing passenger comfort and preparing/serving meals, snacks, and refreshments",,2,llm_v0
1A3X1,S,Completing aircraft forms and border clearance documentation accurately,llm,Completing aircraft forms and border clearance documentation accurately,,2,llm_v0
1A3X1,S,Visually scanning interior/exterior for clearances and proximal threats and initiating corrective actions,llm,Visually scanning interior/exterior for clearances and proximal threats and initiating corrective actions,,2,llm_v0
1A3X1,S,Performing visual and operational checks of air refueling equipment and systems,llm,Performing visual and operational checks of air refueling equipment and systems,,2,llm_v0
1A3X1,S,Directing receiver aircraft into refueling position using standardized calls or signals,llm,Directing receiver aircraft into refueling position using standardized calls or signals,,2,llm_v0
1A3X1,S,Operating in-flight air refueling controls and switches to establish and maintain contact,llm,Operating in-flight air refueling controls and switches to establish and maintain contact,,2,llm_v0
1A3X1,S,Monitoring control panels during refueling and advising receiver pilot to maintain position within the envelope,llm,Monitoring control panels during refueling and advising receiver pilot to maintain position within the envelope,,2,llm_v0
1A3X1,S,Coordinating with tanker pilot and aircrew and providing status updates during refueling,llm,Coordinating with tanker pilot and aircrew and providing status updates during refueling,,2,llm_v0
1A3X1,S,Executing emergency fuel on-load/off-load operations and related procedures,llm,Executing emergency fuel on-load/off-load operations and related procedures,,2,llm_v0
1A3X1,S,Conducting in-flight operational checks of aircraft systems,llm,Conducting in-flight operational checks of aircraft systems,,2,llm_v0
1A3X1,A,Sustained attention and vigilance during prolonged monitoring,llm,Sustained attention and vigilance during prolonged monitoring,,2,llm_v0
1A3X1,A,Multitasking and prioritizing tasks in dynamic flight environments,llm,Multitasking and prioritizing tasks in dynamic flight environments,,2,llm_v0
1A3X1,A,"Rapid problem detection, diagnosis, and decision-making",llm,"Rapid problem detection, diagnosis, and decision-making",,2,llm_v0
1A3X1,A,Spatial awareness and depth perception to judge aircraft position and clearances,llm,Spatial awareness and depth perception to judge aircraft position and clearances,,2,llm_v0
1A3X1,A,Manual dexterity and fine motor control for precise operation of controls and switches,llm,Manual dexterity and fine motor control for precise operation of controls and switches,,2,llm_v0
1A3X1,A,"Clear, concise verbal communication under time pressure",llm,"Clear, concise verbal communication under time pressure",,2,llm_v0
1A3X1,A,Teamwork and coordination within a multi-crew cockpit,llm,Teamwork and coordination within a multi-crew cockpit,,2,llm_v0
1A3X1,A,Strict adherence to procedures and checklists with high accuracy,llm,Strict adherence to procedures and checklists with high accuracy,,2,llm_v0
1A3X1,A,Maintaining situational awareness and assessing risk,llm,Maintaining situational awareness and assessing risk,,2,llm_v0
1A3X1,A,Performing effectively under stress and in emergencies,llm,Performing effectively under stress and in emergencies,,2,llm_v0
1A3X1,A,Balancing passenger service with safety requirements,llm,Balancing passenger service with safety requirements,,2,llm_v0
1A3X1,A,Physical stamina to perform extended in-flight duties,llm,Physical stamina to perform extended in-flight duties,,2,llm_v0
1A3X1,K,"Aircraft electrical, mechanical, hydraulic, pneumatic, navigation, and communication systems",llm,"Aircraft electrical, mechanical, hydraulic, pneumatic, navigation, and communication systems",,3,llm_v0
1A3X1,K,Flight theory and flying directives,llm,Flight theory and flying directives,,3,llm_v0
1A3X1,K,Aircraft emergency procedures,llm,Aircraft emergency procedures,,3,llm_v0
1A3X1,K,In-flight refueling systems and aircraft refueling systems,llm,In-flight refueling systems and aircraft refueling systems,,3,llm_v0
1A3X1,K,Minor in-flight maintenance principles,llm,Minor in-flight maintenance principles,,3,llm_v0
1A3X1,K,"Interpretation of diagrams, schematics, aircraft performance charts, loading charts, technical publications, and flight manuals",llm,"Interpretation of diagrams, schematics, aircraft performance charts, loading charts, technical publications, and flight manuals",,3,llm_v0
1A3X1,K,Weight and balance factors,llm,Weight and balance factors,,3,llm_v0
1A3X1,K,Cargo tie-down techniques,llm,Cargo tie-down techniques,,3,llm_v0
1A3X1,K,Use of survival equipment and oxygen systems,llm,Use of survival equipment and oxygen systems,,3,llm_v0
1A3X1,K,Border agency clearance requirements,llm,Border agency clearance requirements,,3,llm_v0
1A3X1,K,Dispensing and preserving food aboard aircraft,llm,Dispensing and preserving food aboard aircraft,,3,llm_v0
1A3X1,K,"Types, capacities, and configurations of transport aircraft",llm,"Types, capacities, and configurations of transport aircraft",,3,llm_v0
1A3X1,K,Arithmetic/mathematics and physics fundamentals,llm,Arithmetic/mathematics and physics fundamentals,,3,llm_v0
1A3X1,K,Computer principles,llm,Computer principles,,3,llm_v0
1A3X1,K,Communication fundamentals (speech and English),llm,Communication fundamentals (speech and English),,3,llm_v0
1A3X1,S,Ensuring availability of fleet service equipment,llm,Ensuring availability of fleet service equipment,,3,llm_v0
1A3X1,S,Receiving and stowing in-flight meals,llm,Receiving and stowing in-flight meals,,3,llm_v0
1A3X1,S,"Delivering passenger briefings on emergency equipment, evacuation procedures, and border clearance requirements",llm,"Delivering passenger briefings on emergency equipment, evacuation procedures, and border clearance requirements",,3,llm_v0
1A3X1,S,Demonstrating use of passenger emergency oxygen systems and life vests,llm,Demonstrating use of passenger emergency oxygen systems and life vests,,3,llm_v0
1A3X1,S,Supervising passengers in-flight,llm,Supervising passengers in-flight,,3,llm_v0
1A3X1,S,Performing jumpmaster duties,llm,Performing jumpmaster duties,,3,llm_v0
1A3X1,S,Conducting cargo and personnel airdrops in accordance with directives,llm,Conducting cargo and personnel airdrops in accordance with directives,,3,llm_v0
1A3X1,S,Attaching extraction parachutes to cargo and platforms,llm,Attaching extraction parachutes to cargo and platforms,,3,llm_v0
1A3X1,S,"Inspecting cargo, platforms, extraction systems, and related equipment",llm,"Inspecting cargo, platforms, extraction systems, and related equipment",,3,llm_v0
1A3X1,S,Connecting static lines,llm,Connecting static lines,,3,llm_v0
1A3X1,S,"Checking tiedowns, parachutes, containers, suspension, and extraction systems for proper extraction or release",llm,"Checking tiedowns, parachutes, containers, suspension, and extraction systems for proper extraction or release",,3,llm_v0
1A3X1,S,Operating aircraft airdrop systems,llm,Operating aircraft airdrop systems,,3,llm_v0
1A3X1,S,Supervising cargo and paratroopers exiting the aircraft,llm,Supervising cargo and paratroopers exiting the aircraft,,3,llm_v0
1A3X1,S,"Using and interpreting diagrams, schematics, performance/loading charts, and technical manuals",llm,"Using and interpreting diagrams, schematics, performance/loading charts, and technical manuals",,3,llm_v0
1A3X1,S,Calculating and applying weight and balance,llm,Calculating and applying weight and balance,,3,llm_v0
1A3X1,S,Applying cargo tie-down techniques,llm,Applying cargo tie-down techniques,,3,llm_v0
1A3X1,S,Employing survival equipment and oxygen systems,llm,Employing survival equipment and oxygen systems,,3,llm_v0
1A3X1,S,Performing minor in-flight maintenance,llm,Performing minor in-flight maintenance,,3,llm_v0
1A3X1,S,Dispensing and preserving food aboard aircraft,llm,Dispensing and preserving food aboard aircraft,,3,llm_v0
1A3X1,S,Communicating safety and compliance information clearly to passengers,llm,Communicating safety and compliance information clearly to passengers,,3,llm_v0
1A3X1,A,"Ability to supervise and lead passengers, cargo handlers, and paratroopers",llm,"Ability to supervise and lead passengers, cargo handlers, and paratroopers",,3,llm_v0
1A3X1,A,Ability to follow directives and standard operating procedures precisely,llm,Ability to follow directives and standard operating procedures precisely,,3,llm_v0
1A3X1,A,Ability to maintain situational awareness during dynamic flight and airdrop operations,llm,Ability to maintain situational awareness during dynamic flight and airdrop operations,,3,llm_v0
1A3X1,A,Ability to detect discrepancies through careful inspection,llm,Ability to detect discrepancies through careful inspection,,3,llm_v0
1A3X1,A,"Ability to make rapid, sound decisions during emergencies",llm,"Ability to make rapid, sound decisions during emergencies",,3,llm_v0
1A3X1,A,Ability to interpret and apply technical data accurately,llm,Ability to interpret and apply technical data accurately,,3,llm_v0
1A3X1,A,Ability to communicate instructions and safety information clearly,llm,Ability to communicate instructions and safety information clearly,,3,llm_v0
1A3X1,A,Ability to coordinate multiple tasks under time and stress constraints,llm,Ability to coordinate multiple tasks under time and stress constraints,,3,llm_v0
1A3X1,A,Ability to ensure correct weight and balance through quantitative reasoning,llm,Ability to ensure correct weight and balance through quantitative reasoning,,3,llm_v0
1A3X1,A,Ability to demonstrate and instruct proper use of emergency equipment,llm,Ability to demonstrate and instruct proper use of emergency equipment,,3,llm_v0
1A3X1,A,Ability to troubleshoot minor in-flight issues,llm,Ability to troubleshoot minor in-flight issues,,3,llm_v0
1A3X1,A,"Ability to enforce passenger safety, security, and compliance requirements",llm,"Ability to enforce passenger safety, security, and compliance requirements",,3,llm_v0
1A3X1,K,"Aircraft systems, performance, and weight-and-balance principles",llm,"Aircraft systems, performance, and weight-and-balance principles",,4,llm_v0
1A3X1,K,Aircrew qualification standards for Mission Design Series and AF Form 8,llm,Aircrew qualification standards for Mission Design Series and AF Form 8,,4,llm_v0
1A3X1,K,Aircraft records and documentation requirements,llm,Aircraft records and documentation requirements,,4,llm_v0
1A3X1,K,In-flight refueling system components and theory of operation,llm,In-flight refueling system components and theory of operation,,4,llm_v0
1A3X1,K,Load planning principles and cargo handling fundamentals,llm,Load planning principles and cargo handling fundamentals,,4,llm_v0
1A3X1,K,Emergency equipment and in-flight emergency procedures,llm,Emergency equipment and in-flight emergency procedures,,4,llm_v0
1A3X1,K,Personal equipment and oxygen system usage principles,llm,Personal equipment and oxygen system usage principles,,4,llm_v0
1A3X1,K,Aircrew communications procedures and current flying directives,llm,Aircrew communications procedures and current flying directives,,4,llm_v0
1A3X1,K,"Interpretation of diagrams, loading charts, and technical publications",llm,"Interpretation of diagrams, loading charts, and technical publications",,4,llm_v0
1A3X1,K,Border agency clearance requirements and forms,llm,Border agency clearance requirements and forms,,4,llm_v0
1A3X1,K,Principles of dispensing and preserving food aboard aircraft,llm,Principles of dispensing and preserving food aboard aircraft,,4,llm_v0
1A3X1,K,Cargo and personnel airdrop techniques and related equipment,llm,Cargo and personnel airdrop techniques and related equipment,,4,llm_v0
1A3X1,K,"Functions of aviation organizations (Training, Tactics, Scheduling, Evaluations)",llm,"Functions of aviation organizations (Training, Tactics, Scheduling, Evaluations)",,4,llm_v0
1A3X1,K,Mission Ready (MR) and Combat Mission Ready (CMR) standards and currency requirements,llm,Mission Ready (MR) and Combat Mission Ready (CMR) standards and currency requirements,,4,llm_v0
1A3X1,S,Performing aircraft weight and balance computations,llm,Performing aircraft weight and balance computations,,4,llm_v0
1A3X1,S,Maintaining aircraft records and documentation,llm,Maintaining aircraft records and documentation,,4,llm_v0
1A3X1,S,Conducting aircraft systems maintenance and inspections,llm,Conducting aircraft systems maintenance and inspections,,4,llm_v0
1A3X1,S,"Inspecting, operating, and troubleshooting in-flight refueling systems",llm,"Inspecting, operating, and troubleshooting in-flight refueling systems",,4,llm_v0
1A3X1,S,Preparing and verifying load plans,llm,Preparing and verifying load plans,,4,llm_v0
1A3X1,S,Loading and unloading aircraft,llm,Loading and unloading aircraft,,4,llm_v0
1A3X1,S,Instructing passengers on emergency equipment and procedures,llm,Instructing passengers on emergency equipment and procedures,,4,llm_v0
1A3X1,S,Executing in-flight emergency procedures,llm,Executing in-flight emergency procedures,,4,llm_v0
1A3X1,S,Using personal equipment and oxygen,llm,Using personal equipment and oxygen,,4,llm_v0
1A3X1,S,Operating aircrew communications equipment and procedures,llm,Operating aircrew communications equipment and procedures,,4,llm_v0
1A3X1,S,"Interpreting diagrams, loading charts, and technical publications",llm,"Interpreting diagrams, loading charts, and technical publications",,4,llm_v0
1A3X1,S,Completing border agency clearance documentation,llm,Completing border agency clearance documentation,,4,llm_v0
1A3X1,S,Dispensing and preserving food aboard aircraft,llm,Dispensing and preserving food aboard aircraft,,4,llm_v0
1A3X1,S,Conducting cargo and personnel airdrop operations,llm,Conducting cargo and personnel airdrop operations,,4,llm_v0
1A3X1,S,Maintaining and documenting Mission Ready/Combat Mission Ready status,llm,Maintaining and documenting Mission Ready/Combat Mission Ready status,,4,llm_v0
1A3X1,S,"Supporting Training, Tactics, Scheduling, and Evaluations shop functions",llm,"Supporting Training, Tactics, Scheduling, and Evaluations shop functions",,4,llm_v0
1A3X1,A,Ability to compute and verify aircraft weight and balance accurately,llm,Ability to compute and verify aircraft weight and balance accurately,,4,llm_v0
1A3X1,A,Ability to diagnose and resolve issues in in-flight refueling systems,llm,Ability to diagnose and resolve issues in in-flight refueling systems,,4,llm_v0
1A3X1,A,Ability to apply technical directives and publications to operations,llm,Ability to apply technical directives and publications to operations,,4,llm_v0
1A3X1,A,Ability to teach and brief passengers effectively,llm,Ability to teach and brief passengers effectively,,4,llm_v0
1A3X1,A,Ability to perform under time-critical and emergency conditions,llm,Ability to perform under time-critical and emergency conditions,,4,llm_v0
1A3X1,A,Ability to communicate clearly with aircrew and external agencies,llm,Ability to communicate clearly with aircrew and external agencies,,4,llm_v0
1A3X1,A,Physical ability to handle cargo and operate aircraft equipment,llm,Physical ability to handle cargo and operate aircraft equipment,,4,llm_v0
1A3X1,A,Ability to maintain qualification currency and mission readiness,llm,Ability to maintain qualification currency and mission readiness,,4,llm_v0
1A3X1,A,Ability to interpret charts and diagrams quickly and accurately,llm,Ability to interpret charts and diagrams quickly and accurately,,4,llm_v0
1A3X1,A,"Ability to coordinate across training, tactics, scheduling, and evaluations functions",llm,"Ability to coordinate across training, tactics, scheduling, and evaluations functions",,4,llm_v0
1A3X1,A,Ability to adhere to border clearance and regulatory requirements,llm,Ability to adhere to border clearance and regulatory requirements,,4,llm_v0
1A3X1,A,Ability to maintain attention to detail in documentation and inspections,llm,Ability to maintain attention to detail in documentation and inspections,,4,llm_v0
1A3X1,A,"Ability to work safely in aircraft environments, including use of oxygen at altitude",llm,"Ability to work safely in aircraft environments, including use of oxygen at altitude",,4,llm_v0
1A3X1,K,In-flight refueling systems principles and operations,llm,In-flight refueling systems principles and operations,,5,llm_v0
1A3X1,K,Load planning principles,llm,Load planning principles,,5,llm_v0
1A3X1,K,Airdrop techniques and procedures,llm,Airdrop techniques and procedures,,5,llm_v0
1A3X1,K,Aircraft weight and balance principles,llm,Aircraft weight and balance principles,,5,llm_v0
1A3X1,K,Emergency equipment and in-flight emergency procedures,llm,Emergency equipment and in-flight emergency procedures,,5,llm_v0
1A3X1,K,Personal survival equipment and oxygen system use,llm,Personal survival equipment and oxygen system use,,5,llm_v0
1A3X1,K,Aircrew communications procedures,llm,Aircrew communications procedures,,5,llm_v0
1A3X1,K,Current flying directives and regulations,llm,Current flying directives and regulations,,5,llm_v0
1A3X1,K,Technical diagrams and applicable technical publications,llm,Technical diagrams and applicable technical publications,,5,llm_v0
1A3X1,K,Border agency clearance requirements and forms,llm,Border agency clearance requirements and forms,,5,llm_v0
1A3X1,K,Principles of dispensing and preserving food aboard aircraft,llm,Principles of dispensing and preserving food aboard aircraft,,5,llm_v0
1A3X1,K,Cargo restraint principles and techniques,llm,Cargo restraint principles and techniques,,5,llm_v0
1A3X1,K,Flight engineer functions,llm,Flight engineer functions,,5,llm_v0
1A3X1,K,Mobility mission functions and activities,llm,Mobility mission functions and activities,,5,llm_v0
1A3X1,K,DAFMAN 48-123 medical standards for aircrew duty,llm,DAFMAN 48-123 medical standards for aircrew duty,,5,llm_v0
1A3X1,K,AFI 11-402 aviation service qualifications,llm,AFI 11-402 aviation service qualifications,,5,llm_v0
1A3X1,S,Inspecting in-flight refueling systems,llm,Inspecting in-flight refueling systems,,5,llm_v0
1A3X1,S,Operating in-flight refueling systems,llm,Operating in-flight refueling systems,,5,llm_v0
1A3X1,S,Troubleshooting in-flight refueling systems,llm,Troubleshooting in-flight refueling systems,,5,llm_v0
1A3X1,S,Preparing and verifying aircraft load plans,llm,Preparing and verifying aircraft load plans,,5,llm_v0
1A3X1,S,Loading and unloading aircraft cargo,llm,Loading and unloading aircraft cargo,,5,llm_v0
1A3X1,S,Instructing passengers on emergency equipment and procedures,llm,Instructing passengers on emergency equipment and procedures,,5,llm_v0
1A3X1,S,Instructing on airdrop techniques,llm,Instructing on airdrop techniques,,5,llm_v0
1A3X1,S,Computing aircraft weight and balance using arithmetic,llm,Computing aircraft weight and balance using arithmetic,,5,llm_v0
1A3X1,S,Using personal equipment and oxygen systems,llm,Using personal equipment and oxygen systems,,5,llm_v0
1A3X1,S,Conducting aircrew communications,llm,Conducting aircrew communications,,5,llm_v0
1A3X1,S,Interpreting diagrams and technical publications,llm,Interpreting diagrams and technical publications,,5,llm_v0
1A3X1,S,Completing border clearance documentation and forms,llm,Completing border clearance documentation and forms,,5,llm_v0
1A3X1,S,Applying cargo restraint techniques,llm,Applying cargo restraint techniques,,5,llm_v0
1A3X1,S,Dispensing and preserving food aboard aircraft,llm,Dispensing and preserving food aboard aircraft,,5,llm_v0
1A3X1,S,Managing and directing mobility mission activities,llm,Managing and directing mobility mission activities,,5,llm_v0
1A3X1,S,Supervising flight engineer activities,llm,Supervising flight engineer activities,,5,llm_v0
1A3X1,A,"Supervise aviation organizational functions and shops (Training, Tactics, Scheduling, Evaluations)",llm,"Supervise aviation organizational functions and shops (Training, Tactics, Scheduling, Evaluations)",,5,llm_v0
1A3X1,A,Maintain physical qualification for aircrew duty (DAFMAN 48-123 Class III),llm,Maintain physical qualification for aircrew duty (DAFMAN 48-123 Class III),,5,llm_v0
1A3X1,A,Maintain normal depth perception,llm,Maintain normal depth perception,,5,llm_v0
1A3X1,A,Qualify for aviation service and retain aeronautical ratings eligibility (AFI 11-402),llm,Qualify for aviation service and retain aeronautical ratings eligibility (AFI 11-402),,5,llm_v0
1A3X1,A,Maintain eligibility to deploy and mobilize worldwide,llm,Maintain eligibility to deploy and mobilize worldwide,,5,llm_v0
1A3X1,A,Meet height standards per medical standards directory,llm,Meet height standards per medical standards directory,,5,llm_v0
1A3X1,K,Air Force cybersecurity policy (AFI 17-130) and computer security standards (AFMAN 17-1301),llm,Air Force cybersecurity policy (AFI 17-130) and computer security standards (AFMAN 17-1301),,6,llm_v0
1A3X1,K,DoD and Air Force personnel security program policy (DoDM 5200.02; AFMAN 16-1405),llm,DoD and Air Force personnel security program policy (DoDM 5200.02; AFMAN 16-1405),,6,llm_v0
1A3X1,K,"Principles of classified information protection and access tiers (e.g., Tier 3)",llm,"Principles of classified information protection and access tiers (e.g., Tier 3)",,6,llm_v0
1A3X1,K,"Ready Aircrew Program (RAP) mission-readiness categories and requirements (NMR/NCMR, UQ)",llm,"Ready Aircrew Program (RAP) mission-readiness categories and requirements (NMR/NCMR, UQ)",,6,llm_v0
1A3X1,K,"Roles and platform basics for flight engineer, loadmaster, and boom operator on specified aircraft (C-5, C-17, C-130H/J/WC-130, E-3, E-8, EC-130H, KC-10, KC-46, KC-135)",llm,"Roles and platform basics for flight engineer, loadmaster, and boom operator on specified aircraft (C-5, C-17, C-130H/J/WC-130, E-3, E-8, EC-130H, KC-10, KC-46, KC-135)",,6,llm_v0
